{
  "$schema": "https://json-schema.org/draft/2020-12/schema",
  "type": "object",
  "properties": {
    "schema_version": {
      "const": "1.0.0"
    },
    "task_id": {
      "type": "string",
      "minLength": 1
    },
    "fixture_only": {
      "type": "boolean"
    },
    "data_classification": {
      "const": "PUBLIC_NON_SENSITIVE"
    },
    "task": {
      "type": "object",
      "properties": {
        "summary": {
          "type": "string",
          "minLength": 1,
          "maxLength": 600
        },
        "steps": {
          "type": "array",
          "minItems": 1,
          "maxItems": 10,
          "items": {
            "type": "string",
            "minLength": 1,
            "maxLength": 300
          }
        },
        "constraints": {
          "type": "array",
          "maxItems": 10,
          "items": {
            "type": "string",
            "minLength": 1,
            "maxLength": 300
          }
        }
      },
      "required": [
        "summary",
        "steps"
      ],
      "additionalProperties": false
    },
    "location": {
      "type": "object",
      "description": "Where the work happens. The request becomes public when posted, so the place must be one the owner can name publicly.",
      "properties": {
        "description": {
          "type": "string",
          "minLength": 1,
          "maxLength": 300
        },
        "place_name": {
          "type": "string",
          "minLength": 1,
          "maxLength": 200
        },
        "address": {
          "type": "string",
          "minLength": 1,
          "maxLength": 300
        },
        "coordinates": {
          "type": "object",
          "properties": {
            "lat": {
              "type": "number",
              "minimum": -90,
              "maximum": 90
            },
            "lon": {
              "type": "number",
              "minimum": -180,
              "maximum": 180
            }
          },
          "required": [
            "lat",
            "lon"
          ],
          "additionalProperties": false
        },
        "remote_ok": {
          "type": "boolean",
          "description": "True when the task can be done from anywhere (a phone call, a mailed item); false when the performer must be present."
        }
      },
      "required": [
        "description",
        "remote_ok"
      ],
      "additionalProperties": false
    },
    "time_window": {
      "type": "object",
      "properties": {
        "start": {
          "type": "string",
          "format": "date-time"
        },
        "end": {
          "type": "string",
          "format": "date-time"
        },
        "timezone": {
          "type": "string",
          "minLength": 1
        }
      },
      "required": [
        "start",
        "end"
      ],
      "additionalProperties": false
    },
    "evidence_spec": {
      "type": "object",
      "properties": {
        "challenge_token": {
          "type": "string",
          "pattern": "^[A-Z0-9][A-Z0-9-]{6,30}[A-Z0-9]$",
          "description": "A short code the agent invents for this request. Photos marked token_required must show it handwritten or printed on paper in the scene, so a photo taken earlier or found elsewhere cannot serve."
        },
        "items": {
          "type": "array",
          "minItems": 1,
          "maxItems": 10,
          "items": {
            "type": "object",
            "properties": {
              "evidence_id": {
                "type": "string",
                "minLength": 1
              },
              "type": {
                "enum": [
                  "PHOTO",
                  "VIDEO_FRAME",
                  "DOCUMENT",
                  "RECEIPT",
                  "SCREENSHOT",
                  "ATTESTATION"
                ]
              },
              "requirement": {
                "type": "string",
                "minLength": 1,
                "maxLength": 400,
                "description": "What must be visible or included."
              },
              "count_min": {
                "type": "integer",
                "minimum": 1,
                "maximum": 10
              },
              "token_required": {
                "type": "boolean"
              }
            },
            "required": [
              "evidence_id",
              "type",
              "requirement",
              "count_min",
              "token_required"
            ],
            "additionalProperties": false
          }
        }
      },
      "required": [
        "challenge_token",
        "items"
      ],
      "additionalProperties": false
    },
    "performer_requirements": {
      "type": "array",
      "maxItems": 5,
      "items": {
        "type": "string",
        "minLength": 1,
        "maxLength": 200
      }
    }
  },
  "required": [
    "schema_version",
    "task_id",
    "fixture_only",
    "data_classification",
    "task",
    "location",
    "time_window",
    "evidence_spec"
  ],
  "additionalProperties": false
}
